Object,Medium,Pile,Keywords,Local / Location,Location ,Source,Addition Note,Scale,Time
Tiergarten - Terrogruppe,Song - Album,Songs About the Tiergarten,"Narrative, Songs",,https://drive.google.com/file/d/1wRSLQ6n3D2VgbChOJMkTz4O4rf12UHc7/view?usp=sharing,https://open.spotify.com/album/4DkoqaQKIHOFCrvUlOdBTn?si=08d4b0d0d1064a91,Rock band ,Part,
Tiergarten - Brass Riot,Song - Album,Songs About the Tiergarten,"Narrative, Songs, Instrumental Music",,https://drive.google.com/file/d/1x8EwGSVC51oxGlbwNZx4O02sxunkcY5M/view?usp=sharing,https://open.spotify.com/album/013s7BP0s6fUnpuzUDpl0r?si=cb950d4f07504ee8,Instrumental  Music,Part,
Tiergarten- Stromung,Song - Album,Songs About the Tiergarten,"Narrative, Songs, Electronic Music",,https://drive.google.com/file/d/15vnZuyhJXwxVmfOU3zkORAMdmsJJjpYL/view?usp=sharing,https://open.spotify.com/track/3PSV6amjKTT0up0M9kWRPE?si=710361f3c5eb4f7a,Electronic Music,Part,
Tiergarten - Electronite Project,Song - Album,Songs About the Tiergarten,"Narrative, Songs, Electronic Music",,https://drive.google.com/file/d/13iIOvn9CDiG5jet9AfVtUJPHT3KiJEkY/view?usp=sharing,https://open.spotify.com/track/5tRxjDFy5YkpTM16CVpIrH?si=c971458f172940cf,Electrinic Music,Part,
Etching at Brandenburg Gate,Print,Brandenburg gate,"Landmarks, Brandenburg Gate, 1810-1820, Visitors, Crowds, Plantings, Transportation, Class Range",,https://drive.google.com/file/d/14H7oe2tEHJ489Sfw3gbi4QeOm3DP3RSY/view?usp=sharing,"https://commons.wikimedia.org/wiki/File:Vorplatz_am_Brandenburger_Tor,_1818,_Calau.jpg","Current Address: Platz des 18 März. Includes two statues by Georg Franz Ebenhecht, ""Pythian Apollon"" and ""Hercules with Lyra"" (ca. 1746). Still standing?",Part,
Tiergarten - MBR,Song - Album,Songs About the Tiergarten,"Narrative, Songs, Electronic Music",,https://drive.google.com/file/d/1mIrJWwiiZNgI2ir64N3f-gMa-oTD7bQ_/view?usp=sharing,https://open.spotify.com/album/0yCYuJhbKKVszDqLMgZj2A?si=9a65726042de415f&nd=1,Electronic Music,Part,
Die Louisen-Insel im Thiergarten bei Berlin,Print,Luiseninsel,"Landscape, Plantings, 1820-1830, Luiseninsel, Fountains, Fauna",,https://drive.google.com/file/d/1lQQd4r7dWsbODzQzTsYDIk0acbFxNtf7/view?usp=sharing,https://commons.wikimedia.org/wiki/File:Luiseninsel_Tiergarten-GDR-76-57-45.jpg,Nearly identical to entry 58 but from a different artist. ,Part,
Tiergarten after WWII,Photograph,WWII Aftermath Documentation,"Events, WWII, Aftermath, Deforestation, Landmarks, Monument",,https://drive.google.com/file/d/1URVE8HercDryMiplrbVloP2OuE6HDOgo/view?usp=sharing,https://picclick.co.uk/World-War-II-Vintage-Press-Photo-Tiergarten-Park-174419577506.html#&gid=1&pid=1,"Press photograph from the archives of the Philadelphia Inquirer. Clear cpature of deforestation, and monuments to orient. Enough landmarks to be recaptured now using drone?",Some,
Jelly: Chewy Chunks of Hardcore House,Scanned Flyer,Music Event,"Events, Music, Parties, Sound, Regular Events, Ritual, Tuesdays",,https://drive.google.com/file/d/1sZx5VE30n39LxFdFtV5j3pOmf7_P2n_Q/view?usp=sharing,https://www.ebay.co.uk/itm/264353338318?hash=item3d8cafd3ce:g:TDUAAOSwR0JUQsHc,"Location listen as the Tiergarten Bath, subculture / series of events there?",,
Sello Family Tree,Webpage,Sello Family,"Figures, Cultural, Landscape, Plantings, Beaurocracy, Systems",,https://drive.google.com/file/d/1OXgULeXoYZoEwHO_8H6jFYv3mQ6la5AD/view?usp=sharing,https://de.wikipedia.org/wiki/Sello_(G%C3%A4rtnerfamilie),Line of gardeners who served as key planners in the 1700s. ,,
Queer Healing event,Flyer,Event,"Events, Social, Community, Gathering, Meditation, Minority",,https://drive.google.com/file/d/1ZUo6DfyQjL16iZrF_vpVq197IjzK6jd5/view?usp=sharing,https://www.facebook.com/events/4413033645445127/?ref=newsfeed&__cft__[0]=AZWujhdZYMwFWQ2-Gwqsr39fDY_iKrSmeiXS69sweYlPmbxz1wr3he3KdyUTF6FhzuaLwMroswxGNUGFl4kUWSNOYzbKa8bzEscp7W8Zz9sGiA&__tn__=H-R,Meditation event held for TINA members as community gathering space,,
Edward Morike - SeptemberMorgen,Poem,Books - Historical,"Narrative, Poems, Color, Poem, Nature",,https://drive.google.com/file/d/1vjJjIvVMAoTkeVlihTnHF7w2MaT0NYt2/view?usp=sharing,https://collections.mfa.org/objects/275007,Colorful poem about the seasons changing,,
Urban Forests,Presentation,Trees,"Landscape, Plantings, Species",,https://drive.google.com/file/d/1gs1-aT3DJ8RGzehGo1HhAONz0iSsI7n-/view?usp=sharing,https://www.hnee.de/_obj/CE253D23-9745-4AF0-80A9-ADE8F9FA0C37/outline/JEscacena_RPP.pdf,Rudimentary introduction to different plantings in the tiergarten,,
Linden Trees,Species,Trees,"Landscape, Plantings, Species, Climate, Ecology, Ecosystems",,https://drive.google.com/file/d/1Tu3lDL1AlM8bqF6oiofqlWeEY39BYzu0/view?usp=sharing,https://www.berlin.de/senuvk/umwelt/stadtgruen/stadtbaeume/de/alleen/unter_den_linden/index.shtml,"Johann Justus Sello planted 6,000 Linden Tress in 1743 on Straße des 17. Juni. Seems to be other civic disruption around the planting, preservation, and cutting of Linden Trees for development",,
Sense 8 ,Movie,Sense 8 ,"Narrative, Movies, Movie Map, Filmset",,https://drive.google.com/drive/folders/1iGmUvxswLt0tiC2WMxdErql0RL9dgS6w?usp=sharing,https://moviemaps.org/movies/wm,Season 2 Episode 2,,
Larry Levy - Tiergarten,Poem,Narrative,"Narrative, Poems, Zoo",,https://docs.google.com/document/d/1vpmZ95qZ0yEd_GxwwN7F8s7WMbsGtQSTiRIxkmnVbtk/edit,https://www.poemhunter.com/poem/in-the-tiergarten-1933/,Poem about the zoo and society?,,
Tree Population Map,Interactive Database,Trees,"Landscape, Plantings, Species, Planning, Urban Systems, Upkeep, Maintenance",,https://drive.google.com/file/d/1hsaW95Qrnc0uHwJNHp7K8GroD4Eujtjk/view?usp=sharing,https://www.berlin.de/senuvk/umwelt/stadtgruen/stadtbaeume/de/karte/index.shtml,Incredible detail on current plantings in the park,,
Berlin Radiation Map,Graph,Climate Information,"Climate information, Schedules, Climate, Patterns, Outdoor Space Occupabiluty",,https://drive.google.com/drive/folders/11ef91rK62H4qZRoX8fR3lrOuSkq8cYCW?usp=sharing,http://climaplusbeta.com/OUTDOOR,,,
Berlin Wind Chart,Graph,Climate Information,"Climate information, Schedules, Climate, Patterns, Outdoor Space Occupabiluty",,https://drive.google.com/drive/folders/11ef91rK62H4qZRoX8fR3lrOuSkq8cYCW?usp=sharing,http://climaplusbeta.com/OUTDOOR,,,
Berlin Temperature Chart,Graph,Climate Information,"Climate information, Schedules, Climate, Patterns, Outdoor Space Occupabiluty",,https://drive.google.com/drive/folders/11ef91rK62H4qZRoX8fR3lrOuSkq8cYCW?usp=sharing,http://climaplusbeta.com/OUTDOOR,,,
Berlin Population,Graph,Statistics,"Population Statistics, Schedules, Cycles, Growth, Space",,https://drive.google.com/drive/folders/1q2WyKDYiJvr2r7j2thcS01w0uXpHrBAD?usp=sharing,https://worldpopulationreview.com/world-cities/berlin-population,,,
Tourist Population,Graph,Statistics,"Population Statistics, Schedules, BerlinTourism",,https://drive.google.com/drive/folders/1q2WyKDYiJvr2r7j2thcS01w0uXpHrBAD?usp=sharing,https://worldpopulationreview.com/world-cities/berlin-population,,,
Tourism Statistics,Graph,Statistics,"Population Statistics, Schedules, BerlinTourism",,https://drive.google.com/drive/folders/1q2WyKDYiJvr2r7j2thcS01w0uXpHrBAD?usp=sharing,https://www.businesslocationcenter.de/en/tourism/,,,
Sounds of the tiergarten,Sound,Sounds,"Sounds, Recordings, Experience, Sensory quality, Sound files",,https://drive.google.com/drive/folders/1BN734qN53y32oLxcytak1N3vVaWTC4Dn?usp=sharing,https://soundcloud.com/matas/sounds-of-berlin-spring-at,,,
Sound of waterfall in tiergarten,Sound,Sounds,"Sounds, Recordings, Experience, sensory quality, sound files",,https://drive.google.com/drive/folders/1BN734qN53y32oLxcytak1N3vVaWTC4Dn?usp=sharing,https://www.youtube.com/watch?v=uq8jG1JiFq0,,,
The Tiergarten Tales,Book,Book - Fiction,"Books, Fiction, Men, Adventure",,https://drive.google.com/drive/folders/1W3bAfVFPbvgeDu4TFiFC6K4MRdmY-aZV?usp=sharing,https://books.google.com/books?id=L85HEAAAQBAJ&pg=PT195&lpg=PT195&dq=tiergarten+sounds&source=bl&ots=hmMmfBfR8X&sig=ACfU3U0YdIpx8uD6ezTDngaFCHGNf0CT0A&hl=en&sa=X&ved=2ahUKEwiT-biNqdrzAhWtm-AKHV8kBiQQ6AF6BAgUEAM#v=onepage&q=tiergarten%20sounds&f=false,"""Boys and men of Berlin. A captivating journey through their lives, love affairs and misdemeanours across the city’s turbulent history""",,
Read - The Devil's Inner circle,Book exerpt,Book - Historical,"Books, Historical, Privacy, Meeting space",,https://drive.google.com/drive/folders/1GiUNiuPOlSxuufNEqJ8Tb69_YSYUnwfr?usp=sharing,https://books.google.com/books?id=wblLo9fFad8C&pg=PA448&lpg=PA448&dq=tiergarten+sounds&source=bl&ots=WuHHAL1x9X&sig=ACfU3U03ubE5eZt_wutmeCWAcZJsePrPig&hl=en&sa=X&ved=2ahUKEwiT-biNqdrzAhWtm-AKHV8kBiQQ6AF6BAgTEAM#v=onepage&q=tiergarten%20sounds&f=false,Hitler narrative and the tiergarten at the time,,
Godshall - Der Tiergarten: A Story of Combat in the Cold War,Book,Book - Historical,"Books, Historical, Col War, USA troops, USA perspective",,https://drive.google.com/drive/folders/1GiUNiuPOlSxuufNEqJ8Tb69_YSYUnwfr?usp=sharing,https://books.google.com/books?id=9ZF2GGgZe-MC&pg=PA86&lpg=PA86&dq=tiergarten+sounds&source=bl&ots=glhp6EyQka&sig=ACfU3U1SjKF3IG-flql7Ci2suEGhh9XXAQ&hl=en&sa=X&ved=2ahUKEwiT-biNqdrzAhWtm-AKHV8kBiQQ6AF6BAgVEAM#v=onepage&q=tiergarten%20sounds&f=false,Tie between small atown america and theTiergarten during the cold war ,,
Zoo Sound recordings - Tiergarten,Sound,Sounds,"Sounds, Recordings, experience, Sensory quality, Sound files, Animals noises, 2012",,https://drive.google.com/drive/folders/1BN734qN53y32oLxcytak1N3vVaWTC4Dn?usp=sharing,https://www.youtube.com/watch?v=2okXydgUQlo,Sounds of animals,,
Walk throguh the tiergarten - Guided tour,Webpage,Guided Tour,"Activities, Guided Tours, Experience, Narrative, First person, Walk, Activity, International tourism, ",,https://drive.google.com/drive/folders/1v3Dnj4HwK07ZNWN45wrDlAvFQxmcis-S?usp=sharing,https://www.heygo.com/tours/a-walk-through-the-tiergarten,Guided tour by a local 3rd generation berliner,,
NYT_Tiergarten townhouse complex,Webpage,Architecture,"Architecture, Foliage, Green design",,https://drive.google.com/drive/folders/1dSaD9QbV8ZGPDI98JGFmQ4hhI0_BPdu3?usp=sharing,https://www.nytimes.com/2020/11/10/t-magazine/berlin-treehouses.html,Architecture interacting with the edge of the garden,,
Tiergarten Running route,Map,Routes,"Routes, Maps, Speed, Cycles, Marathon events",,https://drive.google.com/drive/folders/11YSa47vXA0qauO0qvzmCqX5tJM62rHwA?usp=sharing,https://greatruns.com/tiergarten-2/,Running routes as way of experiencing the park or knowing ways to avoid speed,,
Berlin Marathon Route,Map,Routes,"Routes, Maps, Speed, Events, Crowds, Marathon ",,https://drive.google.com/drive/folders/11YSa47vXA0qauO0qvzmCqX5tJM62rHwA?usp=sharing,https://www.bmw-berlin-marathon.com/en/your-race/course/spectators/,Running routes as way of experiencing the city or knowing ways to avoid speed. RUnning as event,,
Berlin Marathon Spectators Map,Map,Routes,"Routes, Spectator, Display, Crowds",,https://drive.google.com/drive/folders/11YSa47vXA0qauO0qvzmCqX5tJM62rHwA?usp=sharing,https://www.bmw-berlin-marathon.com/en/your-race/course/spectators/,"Spectator, Display, show",,
Death in the Tiergarten: Murder and Criminal Justice in the Kaiser’s Berlin,Book,Events - Crime,"Books, Fiction, Fiction, Narrative, Crime, Crime scenes, Setup",,https://drive.google.com/drive/folders/1W3bAfVFPbvgeDu4TFiFC6K4MRdmY-aZV?usp=sharing,https://www.amazon.com/Death-Tiergarten-Criminal-Justice-Kaisers/dp/0674013174,"""daily movement through the Berlin criminal courts and the lawyers, judges, jurors, thieves, pimps, and murderers who inhabited this world.""",,
Berlin Events Schedule,Webpage,Events - Contemporary,"Events, Social events, Culture, Public space, Scheduling, Citizens and Tourists",,https://drive.google.com/file/d/1QVXudQUZhhj89VmZdKGhKmiicBAAAq5s/view?usp=sharing,https://www.berlin.de/en/events/,variety of social events,,
Berlin Zoo during the II World War,Images,Zoo,"Berlin Zoo, Events, World War II impact, Zoo, Animals, Military Station",,https://drive.google.com/drive/folders/1HiMX7DO64AdwN8_UrNJjGjbx84CKzHqT?usp=sharing,https://historycollection.com/the-tragic-ordeal-of-the-berlin-zoo-in-world-war-ii/2/,Conditions of the zoo during the war,,
Berlin Zoo Visit Statistics,Graph,Zoo,"Berlin Zoo, Public amenity, Use, Public Space, Likeability, Park Landmark",,https://drive.google.com/drive/folders/1HiMX7DO64AdwN8_UrNJjGjbx84CKzHqT?usp=sharing,https://www.statista.com/statistics/673269/ranking-german-zoos-by-visitor-number/,Zoo Visits per year and in comparison to the rest of the country,,
Berlin Zoo Ad Poster,Image,Zoo,"Berlin Zoo, Advertisement, Communication, Image, ",,https://drive.google.com/drive/folders/1HiMX7DO64AdwN8_UrNJjGjbx84CKzHqT?usp=sharing,https://www.google.com/url?sa=i&url=https%3A%2F%2Fwww.design-is-fine.org%2Fpost%2F64334025348%2Fjulius-klinger-advertising-poster-for-the-berlin&psig=AOvVaw2LmilxqeOn_6MYyE4B3wEE&ust=1634965576575000&source=images&cd=vfe&ved=0CAwQjhxqFwoTCMjmo8Wf3fMCFQAAAAAdAAAAABAl,Graphic Poster for the zoo,,
Peter Lenne Bust,Image,Zoo,"Berlin Zoo, Bust, Memorial, Gardner, Landscape Architecture",,https://drive.google.com/drive/folders/1LJAeURLxR21K7YpJaB4Ofgleppgi3i8w?usp=sharing,https://www.imago-images.com/bild/st/0067919669/w.jpg,,,
"Tiergarten, Landscape of Transcgression",Lecture video,Lectures,"Berlin, Lecture, ETH, Sandra Bartoli , Transgression, City and Nature",,https://drive.google.com/drive/folders/1SECtr6-H0RcSdMoO6f7TM6RNqU8bCM7L?usp=sharing,https://topalovic.arch.ethz.ch/Libraries/Lectures/Tiergarten-Landscape-Of-Transgression-This-Obscure-Object-Of-Desire,,,
Audio description of the Tiergarten,Audio,Lectures,"Digital Visit, Recording, Audio, Column of Victory",,https://drive.google.com/drive/folders/1SECtr6-H0RcSdMoO6f7TM6RNqU8bCM7L?usp=sharing,https://mywowo.net/en/germany/berlin/tiergarten/presentation#,,,
Local life - Love parade 2006,Article,LGBTQ Events,"Events , Festival, Music Festival, Electronic Music, Crowds",,https://drive.google.com/file/d/1oJmd2rqdqsSEN6s8DlDk5qteRxRQBAWK/view?usp=sharing,https://www.local-life.com/berlin/articles/love-parade,,,
Local life - Love parade History,Article,LGBTQ Events,"Events , Festival, Music Festival, Electronic Music, Crowds, CHronology",,https://drive.google.com/file/d/1glqkEiTe_lDECxL1Rj8yrxmbG84a5Jk6/view?usp=sharing,https://www.local-life.com/berlin/articles/berlin-love-parade,,,
Share of the Zoo,Document,Zoo,"Berlin Zoo, Document, Share, Finance",,https://drive.google.com/file/d/1je_hZeYG4LLOe2b0YQQ7mW8AVlP0zf2j/view?usp=sharing,https://upload.wikimedia.org/wikipedia/commons/thumb/4/4a/Actien-Verein_des_zoologischen_Gartens_1909.JPG/1280px-Actien-Verein_des_zoologischen_Gartens_1909.JPG,,,
LGBTQ parade route,Webpage,Routes,"LGBTQ, Victory Column, Parade, Crowd, March, ",,https://drive.google.com/file/d/1ksC2O086A0XnQbl38a4cPmzF93W-15Hv/view?usp=sharing,https://csd-berlin.de/historie/csd-berlin-2019/demo-route/,,,
LGBTQ parade images,Webpage,LGBTQ Events,"LGBTQ, Victory Column, Parade, Crowd, March, Community, Contemporary",,https://drive.google.com/file/d/1bUauSsC37ijbkQpmIPGWgJG8dP39Lafs/view?usp=sharing,https://csd-berlin.de/csd-berlin-2021/bilder-csd-berlin-2021/,,,
LGBTQ parade 2021 Speeches,Videos,LGBTQ Events,"LGBTQ, Victory Column, Parade, Crowd, March, Speeches, Community",,https://drive.google.com/file/d/19DP4cvDyHUsLkU7jcYL5oFnTN1T3N3LK/view?usp=sharing,https://csd-berlin.de/csd-berlin-2021/reden-csd-berlin-2021/,,,
1987 Reagan Speech,Video ,Political,"Reagan, USA, Brandenburg Gate, WW2, Speech, ",,https://drive.google.com/file/d/1mn2790RElzLLhPKYimoll9UK6Y8MAvPl/view?usp=sharing,https://www.americanrhetoric.com/speeches/ronaldreaganbrandenburggate.htm,,,
1997 Green Area Act,Webpage,Political,"Green Area, Parks, Preservation, Urban Life, Jane Jacobs, Legal ",,https://drive.google.com/file/d/1UvODtSKdds7G1Gs5YZkf_iwSXc-LkBHu/view?usp=sharing,https://www.berlin.de/sen/uvk/natur-und-gruen/stadtgruen/oeffentliche-gruen-und-erholungsanlagen/gruenanlagengesetz/,,,
Tiergarten Tunnels - Bartlett Project,PDF ,Routes,"Green Area, Circulation Structure, Concrete, Navigation, Hidden lines",,https://drive.google.com/file/d/1gD9ZalTZPe0KvDPyXyBfpLRxURzWgwh0/view?usp=sharing,http://www.omegacentre.bartlett.ucl.ac.uk/wp-content/uploads/2014/12/GERMANY_TIERGARTENTUNNEL_SUMMARY.pdf,,,
Peter Herrman Painting,Image,Art,"Art, Painting ",,https://drive.google.com/file/d/1GvDHr7kDATgR4wSMJrCz_ULdqoehY-x8/view?usp=sharing,http://www.artnet.com/artists/peter-herrmann/events,,,