Object,Medium,Pile,Keywords,Local / Location,Location ,Source,Addition Note,Scale,Time
,,,,,,,,,
Berlin Stories - R. Walser,Book,First Person Narrative,"Narrative, Historical, First Person",,https://drive.google.com/drive/folders/1GiUNiuPOlSxuufNEqJ8Tb69_YSYUnwfr?usp=sharing,https://lib.mit.edu/search/bento?q=tiergarten,,,
Walking in Berlin: A Flaneur in the Capital,Book,First Person Narrative,"Narrative, Historical, First Person",,https://drive.google.com/drive/folders/1GiUNiuPOlSxuufNEqJ8Tb69_YSYUnwfr?usp=sharing,https://lib.mit.edu/search/bento?q=tiergarten,,All,
Blue Tiergarten,Poem,First Person Narrative,"Narrative, Historical, First Person",,https://drive.google.com/drive/folders/1GiUNiuPOlSxuufNEqJ8Tb69_YSYUnwfr?usp=sharing,https://lib.mit.edu/search/bento?q=tiergarten,,Some,
Soviet Officers at Soviet Memorial,Photo,Soviet War Memorial,"Places, Monument, Memorial, Soviet Memorial, Historical,Soviet Monuments, Protest, Pilgrimage, Protection",,https://drive.google.com/file/d/1GwnfRNfENxf0_HcCUjOeOMQjLNGDkiE7/view?usp=sharing,https://berlinpoche.de/en/soviet-war-memorial-berlin-tiergarten,,Part,
Public Posting Soviet memorial,Photo,Soviet War Memorial,"Places, Monument, Memorial, Soviet Memorial, Contemporary",,https://drive.google.com/file/d/1qzvoR-RNmSqsjDJQYGg25DmiyP9ybJd-/view?usp=sharing,https://www.nationalww2museum.org/war/articles/battle-of-berlin-memorial-tiergarten,,Part,
Soviet Memorial Posting,Photo,Soviet War Memorial,"Places, Monument, Memorial, Soviet Memorial, Historical",,https://drive.google.com/file/d/1952p-SWGArmeybKmIWhW2AUZWZcQzpkC/view?usp=sharing,https://aircrashsites.co.uk/history/dsc_0037-copy-2-jpg/,,Part,
Russian Military Building Mini-Reichstag,Newspaper Article,Reichstag,"Places, Builidng, Government, Reichstag, Reenacment, Nationalism, WWII",,https://drive.google.com/file/d/1vJzs0rANkwY3KAo_WC3tYd6qKY3XfutH/view?usp=sharing,https://www.washingtonpost.com/news/worldviews/wp/2017/02/22/the-russian-military-is-building-a-mini-reichstag-at-its-amusement-park-so-that-kids-have-a-real-building-to-storm/,,Part,
Potato Farming,Photo,Farming,"Activities, Farming",,https://drive.google.com/file/d/1qFEM3SBXDn7J_FMjln6mb5tPOOOei-dm/view?usp=sharing,https://www.washingtonpost.com/news/worldviews/wp/2017/02/22/the-russian-military-is-building-a-mini-reichstag-at-its-amusement-park-so-that-kids-have-a-real-building-to-storm/,,Part,
Potato Farming,Photo,Farming,"Activities, Farming",,https://drive.google.com/file/d/1EswylA1CaxxZ-iznZd92EfICK0cP9a6c/view?usp=sharing,https://www.gettyimages.com/photos/tiergarten-1948,,Part,
Park rules (eng),Link,Rules,"Activities, Rules",,https://drive.google.com/file/d/1jBtyiZfRxxuXnGWKL1Ily2tyg_T1qqHD/view?usp=sharing,https://www.berlin.de/sen/uvk/en/nature-and-green/urban-green-space/public-parks/use-rules-and-services/,,All,
Bobby the Gorilla monument,Photo,Fauna,"Occupants, Inhabitants, Fauna",,https://drive.google.com/file/d/1vhSx3kKil6TBjT9rgBsHQYisqHKGLfo5/view?usp=sharing,https://de.wikipedia.org/wiki/Bobby_(Gorilla),,Part,
Berlin Zoo Logo,Image,Fauna,"Occupants, Inhabitants, Fauna",,https://drive.google.com/file/d/1xWVA7pRUyv37jTMuvodtDqu3K1C7rBIe/view?usp=sharing,https://de.wikipedia.org/wiki/Zoologischer_Garten_Berlin,,Part,
History of the Flora and Vegetation of Berlin,PDF - Article,Flora,"Occupants, Inhabitants, Flora",,https://drive.google.com/file/d/1RfiHh15CSQFvVjcVBPmaDyB6IPuaGzrA/view?usp=sharing,https://www.persee.fr/docAsPDF/jatba_0183-5173_1997_num_39_2_3628.pdf,,Some,
Botanical Garden website,Webpage,Flora,"Occupants, Inhabitants, Flora",,https://drive.google.com/file/d/1Ldu286cnRQ_-Z80XSI301KN1Y94vCTkH/view?usp=sharing,https://www.bo.berlin/,,Part,
Botanical Garden Promo. content,Images,Flora,"Occupants, Inhabitants, Flora",,https://drive.google.com/drive/folders/1Ot27NBvCvNpDpxW2swxFD4XvHFzZlkLx?usp=sharing,https://www.bo.berlin/,,Part,
Botanical Garden Schedule,Image,Schedules,"Schedules, Contemporary",,https://drive.google.com/file/d/1m2MStVOiUMFyir1s4m6rptuwuDaqNbwx/view?usp=sharing,https://www.bgbm.org/en/opening_hours,,Part,
Botanical Garden Map,Map,Contemporary Maps,"Maps, Contemporary",,https://drive.google.com/file/d/1GNbo4BKja1nfUdSDdsxZESFhYZaC3v-M/view?usp=sharing,https://www.bgbm.org/en/garden/survey-garden,,Part,
Dog on Frozen Lake,Reddit Thread,Visitors,"Occupants, Visitors",,https://drive.google.com/file/d/1wIg9RAmE6bQXQx8o7qZw7IObhbvu37rA/view?usp=sharing,https://www.reddit.com/r/travel/comments/810bhz/having_a_stroll_on_a_frozen_lake_in_tiergarten/,,Part,
Dog on Frozen Lake,Photo,Ice Skating,"Activites, Ice Skating",,https://drive.google.com/file/d/14WXQNZl4wrcFnh5-vFdP3cyLmaHimjy6/view?usp=sharing,https://i.redd.it/j3bbs28t61j01.jpg,,Part,
"Ice Skating in the Tiergarten, Berlin",Painting,Ice Skating,"Activites, Ice Skating",,https://drive.google.com/file/d/1i8XXBXnREChcAoNNLy-ZGzZWQB3eMY6d/view?usp=sharing,https://uploads3.wikiart.org/images/lovis-corinth/ice-skating-rink-in-the-tiergarten-berlin-1909.jpg,,Some,
View of the Tiergarten,Drypoint,Flags,"Landscape, Waterways, Flags",,https://drive.google.com/file/d/13IsokSb4V7HdYhnlEmUxHUZi-Wi8hHwt/view?usp=sharing,https://www.artsy.net/artwork/lovis-corinth-view-of-the-tiergarten-aus-dem-tiergarten,,All,
Der Neue See Im Berliner Tiergarten,Painting,Flags,"Landscape, Waterways, Flags",,https://drive.google.com/file/d/1msmBLF4dZSmaDNtViQC8g2NiDhI6mVbR/view?usp=sharing,https://commons.wikimedia.org/wiki/File:Corinth_Der_neue_See_im_Berliner_Tiergarten.jpg,,Part,
Birch Trees in the Tiergarten,Drypoint,Trees,"Occupants, Inhabitants, Flora, Trees",,https://drive.google.com/file/d/1aIDWlZXr2ktlUdl6zrQwtIVvNOydRAVs/view?usp=sharing,https://upload.wikimedia.org/wikipedia/commons/6/62/Lovis_Corinth%2C_Birch_Trees_in_the_Tiergarten%2C_1920-1921%2C_NGA_153568.jpg,,Some,
Homeless encampment in Tiergarten,Image,Inhabitants,"Occupants, Inhabitants",,https://drive.google.com/file/d/1GNbo4BKja1nfUdSDdsxZESFhYZaC3v-M/view?usp=sharing,https://www.thelocal.de/20171025/how-berlin-politics-is-struggling-to-find-solutions-to-growing-homelessness/,,Some,
Trees with the Sun,Drypoint,Trees,"Occupants, Inhabitants, Flora, Trees",,https://drive.google.com/file/d/1HTfxEZnMHtqovzh9JjfIO_Onfn2wtbNG/view?usp=sharing,https://upload.wikimedia.org/wikipedia/commons/7/78/Lovis_Corinth%2C_Trees_with_the_Sun_%28Winter_in_the_Tiergarten%29%2C_1920-1921%2C_NGA_131863.jpg,,Part,
Hommage à Berlin- Gorny,Photos ,First Person Narrative,"Narrative, Historical, First Person",,https://drive.google.com/drive/folders/1GiUNiuPOlSxuufNEqJ8Tb69_YSYUnwfr?usp=sharing,https://www.collectionregard-english.com/exhibitions-in-the-collection-regard-2/archive-2/hein-gorny-hommage-%C3%A0-berlin/,,Some,
Lovis Corinth,Artist,Painters,"Paintings, Painter",,https://drive.google.com/file/d/1V-I7WeujQQMRuF4SDf1ybVFwrsZQzAH8/view?usp=sharing,https://www.kettererkunst.com/details-e.php?obnr=119002549&anummer=496,,Part,
At the Zoo,Drypoint,Zoo,"Landscape, Waterways, Zoo",,https://drive.google.com/file/d/1pPAFwewXrLsTOyD1Ecc0AtfdfnwotMAo/view?usp=sharing,https://www.google.com/url?sa=i&url=https%3A%2F%2Fartvee.com%2Fdl%2Fat-the-zoo%2F&psig=AOvVaw10dOmmyCotVH0suuI-UtZk&ust=1632253967027000&source=images&cd=vfe&ved=0CAsQjRxqFwoTCMjh6YKqjvMCFQAAAAAdAAAAABAD,,Part,
Herzog De Meuron Ideas Architecture Project,Screenshot,Architecture,"Twitter, Architecture, Contemporary",,,https://www.herzogdemeuron.com/index/projects/complete-works/051-075/071-berlin-zentrum.html,,Part,
Tennis in the Tiergarten,Photo,Tennis,"Activities, Sports, Tennis, Zoo",,https://drive.google.com/file/d/1CqkFjeR2Fb-NppylSW46rNwWhjhPOe-q/view?usp=sharing,"https://commons.wikimedia.org/wiki/File:Tennis_court_in_the_Tiergarten,_Berlin_1900.jpg",,Part,
Siegesallee in Berlin,Postcard,Siegesallee,"Landscape, Streets, Siegesallee",,https://drive.google.com/file/d/15aA0lf9vuBf1eif0aDT488CNCSgDxu98/view?usp=sharing,https://deademperorssociety.com/tag/siegesallee/,,Part,
Dachsunds Advertisement carriage,Photo,VIsitors,"Occupants, Visitors",,https://drive.google.com/file/d/1emU_Xh0Shhi8dk5YkwH2tDExtqRV7DTQ/view?usp=sharing,https://twitter.com/PiwowarczykJ/status/1437038948711288839,,Part,
Botanical Garden PostStamp,PostStamp,Botanical Garden,"Places, Botanical Garden",,https://drive.google.com/file/d/16dGhe0rO9N_EdWAjcb4yRdRIBaX4oGBC/view?usp=sharing,https://www.dreamstime.com/venus-slipper-orchid-great-tropical-house-years-botanical-garden-berlin-serie-circa-moscow-russia-june-postage-stamp-image222953353,,Part,
Buried Terracotta Army,Article,Siegesallee Statues,"Landscape, Streets, Siegesallee, Statues, Buried, Monuments",,https://drive.google.com/file/d/1EkgrTzZn93sjI0KLbE344zWJ46Vzmsbl/view?usp=sharing,https://deademperorssociety.com/tag/siegesallee/,,Part,
"Siegesalle Map, 1902",Map,Siegesallee Statues,"Landscape, Streets, Siegesallee",,https://drive.google.com/file/d/1-ZemjgD1xZGgjM8A3YE2VPrEJD_jwSuy/view?usp=sharing,https://en.wikipedia.org/wiki/Siegesallee,"Map of Siegesallee has all of the statues labeled in sequence, shows surrounding streets and plantings",Some,
"Kurt Tucholsky, Bruch",Poem,Siegesallee Statues,"Landscape, Streets, Siegesallee, Statues, Satire, Monuments",,https://drive.google.com/file/d/1YQg3LnRDDuespmHRckZKO3eU-PyLCzA9/view?usp=sharing,http://digi.ub.uni-heidelberg.de/diglit/ulk1918/0198?sid=dea1efe2d4b22b3f3873730aa8153787,,Part,
Siegesallee in Berlin,Postcard,Siegesallee Statues,"Landscape, Streets, Siegesallee, Statues, Monuments, Souvenirs",,https://drive.google.com/file/d/1oI0p5SuQJd8MrSoVoxv0FE28MDftfeF7/view?usp=sharing,https://upload.wikimedia.org/wikipedia/commons/8/88/Siegesallee2_Berlin.JPG,The statues have since been removed and many trees were clearcut following WWII. all points of reference in image have been dislocated. ,Part,
Siegesallee Statues,Overview,Siegesallee Statues,"Landscape, Streets, Siegesallee, Statues",,https://drive.google.com/file/d/1oWDae8Idlac_usGa9wKkGdk1ytjF5osQ/view?usp=sharing,https://en.wikipedia.org/wiki/Siegesallee,,Part,
Sculptors of Siegesallee Statues,List,Siegesallee Statues,"Landscape, Streets, Siegesallee, Statues, Sculptors",,https://drive.google.com/file/d/1TJtU0N5D_fRtwsMIQJ2f4iHVYF6noJ7P/view?usp=sharing,https://en.wikipedia.org/wiki/Siegesallee,Robust compilation of documentaion and information for the siegesallee statues. ,Part,
"The Berliner, Ballad of Berlin",Film,Siegesallee Statues,"Landscape, Streets, Siegesallee, Statues, Film",,https://drive.google.com/file/d/12OdMh8yaOQYmY-AE22r7ypOg_GHnwO3n/view?usp=sharing,https://www.imdb.com/title/tt0040156/?ref_=ttfc_fc_tt,,Part,
Documentation of Siegesallee Statues,List,Siegesallee Statues,"Landscape, Streets, Siegesallee, Statues, Monuments ",,https://drive.google.com/file/d/14qjffTmVEMBsWVBhLbcnekKakq47XQqo/view?usp=sharing,https://seenthis.net/messages/501870,,Part,
Stand by me trees,Images,Trees,"Occupants, Inhabitants, Flora, Trees, Anonymous, graffiti, unsanctioned monument, 2010-2020",,https://drive.google.com/file/d/1nDAl_mn544xPe1agGpDjyBnC0CTPvT_Q/view?usp=sharing,https://assets.atlasobscura.com/media/W1siZiIsInVwbG9hZHMvcGxhY2VfaW1hZ2VzL3FqN2x5aXU5b3FlYjQ3ZDc4MmM2YzI4NmNkMTIwX19NR184MDUwcmUuanBnIl0sWyJwIiwidGh1bWIiLCJ4MzkwPiJdLFsicCIsImNvbnZlcnQiLCItcXVhbGl0eSA4MSAtYXV0by1vcmllbnQiXV0/_MG_8050re.jpg,"The lyrics to Ben E. King's song ""Stand By Me"" are carved into a pair of trees. The date of carving has not been identified but could be narrowed through comparison of photos of this tree stand over time.",Part,
The Package,Film,Film,"Places, Monument, Memorial, Soviet Memorial, Contemporary, Cold War, Conspiracy theory, Filming location",,https://drive.google.com/file/d/1I_C-goMOvChQEea5qROYlAamHsl4YDmH/view?usp=sharing,https://www.imdb.com/title/tt0098051/?ref_=adv_li_tt,Features scene filmed in Teirgarten at the Soviet War Memorial. Many of the other scenes for the movie supposedly set in germany were filmed in Illinois.,Part,
Memorial to the Sinti and Roma Victims of National Socialism,Photo,Sinti and Roma Memorial,"Places, Monument, Memorial, Sinti and Roma Memorial, WWII, National Memory, Minority, Water feature, Stone construction, 2010-2020, Israeli",,https://drive.google.com/file/d/1UsY_3iMlxEkOKAa4kQAYTI5coOmII9WQ/view?usp=sharing,https://upload.wikimedia.org/wikipedia/commons/f/f0/Berlin_Sinta_and_Roma_memorial_2014-2.jpg,Memorial built in 20212 after long standing accusations that the persecution of Roma and Sinti populations by the Nazi's was underacknowldged. ,Part,
Sinti and Roma Fear for their Holocaust Memorial in Berlin,Article,Sinti and Roma Memorial,"Places, Monument, Memorial, Sinti and Roma Memorial, WWII, National Memory, Minority, Water feature, Stone construction, 2010-2020, Construction, Threatened, Demolition",,https://drive.google.com/file/d/1V08o5IOs946g3c62r9mKj4m0yuNnuxHJ/view?usp=sharing,https://www.dw.com/en/berlin-sinti-roma-holocaust-memorial/a-54396853,Recently built memorial is threatened by the construciton of new transit lines. ,Part,
Memorial to the SInti and Roma Victims of National Socialism,Photo,Sinti and Roma Memorial,"Places, Monument, Memorial, Sinti and Roma Memorial, Politicians, Merkel, Events, WWII, National Memory, Minority, Water feature, Stone construction, 2010-2020, Construction, Threatened, Demolition",,https://drive.google.com/file/d/1BFm248HJf5jAijQOEpezen4Vu7guNqSg/view?usp=sharing,https://www.nytimes.com/2012/10/25/world/europe/memorial-to-romany-victims-of-holocaust-opens-in-berlin.html,"Attendants at opening of Roma and Sinti Memorial. Merkel, captured in opening photograph, is leaving office as this memorial is udner threat. ",Part,
Reichstag with Sinti and Roma Memorial,Photo,Sinti and Roma Memorial,"Places, Builidng, Government, Reichstag, Memorial, Monument, Intersection, Park boundary",,https://drive.google.com/file/d/1IhE1YO6WkW0B6rsKsyfzOUbnRsaYrRe6/view?usp=sharing,https://www.dw.com/en/germany-debates-world-war-ii-memorial-for-poland/a-49461328,Spatial interaction between Memorial and Reichstag. ,Part,
Laying of Flower on memorial,Routine,Sinti and Roma Memorial,"Activities, Routine, Daily, Memorial, Cycles, Flora",,https://drive.google.com/file/d/1xS_h-3dB1eCyj89E8ODGn_5IlKkOKaMi/view?usp=sharing,https://www.atlasobscura.com/places/memorial-to-the-sinti-and-roma-victims-of-national-socialism,The flower on the central pedestal of the memorial is replaced daily. Who replaces it? What other routines happen on this scal ein the aprk?,Part,
Plan of Berlin 1798,Map,"Maps, 1700s","Maps, City scale",,https://drive.google.com/file/d/1lpoPYOC2uflWskJ_MMKDqYtT7mvzc2bU/view?usp=sharing,https://www.gifex.com/fullsize-en/2011-05-31-13829/Berlin_1798.html,"Two plans in the same style very close in time of drawuing, could be used for incremental comparison at the turn of the 19th c. ",Part,
Plan of Berlin 1802,Map,"Maps, 1800s","Maps, City scale",,https://drive.google.com/file/d/1ILe7-AtV5KmVjlJZDjV2JUPQtnFpuDr2/view?usp=sharing,https://upload.wikimedia.org/wikipedia/commons/b/b4/Schneider%2C_Plan_von_Berlin%2C_1802.jpg,"Two plans in the same style very close in time of drawuing, could be used for incremental comparison at the turn of the 19th c. ",Part,
Sterograph of Sieges Allees,Stereograph,Siegesallee,"Landscape, Streets, Siegesallee,Victory Column, Streetscape, memorabilia",,https://drive.google.com/file/d/1Xq7O0yhJ2UAK4khfyBjxNs6EDT5BDghZ/view?usp=sharing,https://www.loc.gov/resource/stereo.1s24496/,,Part,
Sterograph of Sieges Allees,Stereograph,Siegesallee,"Landscape, Streets, Siegesallee, Tree, Published, Addressed",,https://drive.google.com/file/d/1fl_CQx82bJHNwlqOujuf0vq2HjWWxmup/view?usp=sharing,https://www.loc.gov/resource/stereo.1s24687/,"Stereographs casptured as part of tourist views and distributed in the states. Address for the image is given, could lead to contemporary location?",Part,
Photograph of Woman in Coat,Photo,Visitors,"Occupants, Visitors, 1920-1930, Fashion, Setting, Materials, Photography",,https://drive.google.com/file/d/1SmL4PbadxZR8OSAUSBUZSJhirvKS-EwP/view?usp=sharing,http://www.smb-digital.de/eMuseumPlus?service=direct/1/ResultLightboxView/result.t2.collection_lightbox.$TspTitleLink.link&sp=10&sp=Scollection&sp=SfieldValue&sp=0&sp=0&sp=3&sp=Slightbox_3x4&sp=12&sp=Sdetail&sp=0&sp=F&sp=T&sp=15,Photograph from the Staadliche Museum archive.  Taken in the Berlin Zoo,Part,
In Tiergarten,Photo,Visitors,"Activities, Sports, Horseback Riding, 1920-1930, Setting, Photography, Paths, Old Growth Forest, Visitors ",,https://drive.google.com/file/d/1E8JZKSJav3KeUbgAhQ460IBtpPsoh5cB/view?usp=sharing,http://www.smb-digital.de/eMuseumPlus?service=ExternalInterface&module=collection&objectId=1703014&viewType=detailView,Photograph of figure on horesback recedining in trees. ,Part,
At the tents in Berlin's Tiergarten,Painting,Tents,"Landscape, Historic, Tents, 1760-1770, Temporary structures",,https://drive.google.com/file/d/1EqNz_W2nFG1lB6hD-avRQzOSwo1PZV7S/view?usp=sharing,http://www.smb-digital.de/eMuseumPlus?service=ExternalInterface&module=collection&objectId=1049809&viewType=detailView,What tents are these? Referred to in title as a landmark or established part of the tiergarten,Part,
Old Berlin views. Luiseninsel in the Tiergarten,Painting,Luiseninsel,"Landscape, Plantings, 1820-1830. Luiseninsel, Fountains",,https://drive.google.com/file/d/1VBErsqeG8kYYkYKXPMQImhJbfig5qEJ4/view?usp=sharing,http://www.smb-digital.de/eMuseumPlus?service=direct/1/ResultLightboxView/result.t2.collection_lightbox.$TspTitleLink.link&sp=10&sp=Scollection&sp=SfieldValue&sp=0&sp=0&sp=3&sp=Slightbox_3x4&sp=0&sp=Sdetail&sp=0&sp=F&sp=T&sp=8,Capture of historic plantings.,Part,
Burglary at the Zoo,Photograph,"Burglary at the Zoo, 1980","Events, Crime, 1980-1990, Interiors, Government Buildings",,https://drive.google.com/file/d/1zDLoDzbNPFt__9rtI710J9TRb1ojkT3R/view?usp=sharing,http://www.smb-digital.de/eMuseumPlus?service=ExternalInterface&module=collection&objectId=1912599&viewType=detailView,Burglary into the premises of the building department of the general directorate and the federal building directorate in the zoo,Part,
Burglary at the Zoo,Photograph,"Burglary at the Zoo, 1980","Events, Crime, 1980-1990, Interiors, Government Buildings",,https://drive.google.com/file/d/1suZ9oXfdbsZydxjwYABzHVrsnyV40xd6/view?usp=sharing,http://www.smb-digital.de/eMuseumPlus?service=ExternalInterface&module=collection&objectId=1912588&viewType=detailView,Burglary into the premises of the building department of the general directorate and the federal building directorate in the zoo,Part,
Tiergarten District Extinguishing Cradle,Object,Bureaucracy,"Bureaucracy, Wood, Artifact",,https://drive.google.com/file/d/1wyaTzuupLRsHqE36ACMuZH0RMYDkKx6W/view?usp=sharing,http://www.smb-digital.de/eMuseumPlus?service=ExternalInterface&module=collection&objectId=1937691&viewType=detailView,"Beech wood office implement, Tiergarten District. Laquered Beech Wood.",Part,
Oedipus on the Colossus Mural,Mural,Kaiser Wilhelm Gymnasium,"Places, Buildings, Kaiser Wilhelm Gymnasium, Monumental, Artwork, Parable, Narrative",,https://drive.google.com/file/d/1x0Mjog2rs1zDaI6_iRj-Hbxp6PYXZRoy/view?usp=sharing,http://www.smb-digital.de/eMuseumPlus?service=ExternalInterface&module=collection&objectId=960065&viewType=detailView,"Mural from the auditorium of the Kaiser-Wilhelm-Gymnasium, intended to serve as virtue model for students of the school. When was it removed?",Part,
Skeleton of an Elk,Object,Organic Matter,"Artifacts, Organic, Buried, Archeaological, Pre-human history, Animal occupants",,https://drive.google.com/file/d/1sCALILv7hx7KjwHkF5BV3jItttX9IrGR/view?usp=sharing,http://www.smb-digital.de/eMuseumPlus?service=ExternalInterface&module=collection&objectId=1534225&viewType=detailView,"Species of elk now extinct, diesd naturally. Discovered during the construction of the underground in 1956",Part,
Reichstag and victory column,Photo,Vistory Column,"Places, Buildings, Monument, Moved object, Victory column",,https://drive.google.com/file/d/17XWeCIZxNLD1z1llreys3zhAj40GJ6Nl/view?usp=sharing,https://www.vanupied.com/berlin/activites-faire-berlin/parc-du-tiergarten-a-berlin.html,The column was later moved to its current location,Part,
Autumn Evening,Painting,Visitors,"Landscape, Waterways, Paulvorgang, Artist, Berlin Zoo, Visitors, Walking",,https://drive.google.com/file/d/1xdgcQWuTMit6nJX7rhQmedqreIE29kRQ/view?usp=sharing,http://www.smb-digital.de/eMuseumPlus?service=ExternalInterface&module=collection&objectId=961358&viewType=detailView,"Canal Lansdscape ""could"" represent a motif from the Berlin Zoo. Interested in what would indicate or prove that this is  in fact in the Tiergarten or not",Part,
Cafe in Tiergarten (neuen see),Photo,Cafe Culture,"Activities, Daily, Social ",,https://drive.google.com/file/d/1-BBE8Q8py8_ZVsPq7d0tGhi7nqwRgBDE/view?usp=sharing,https://www.vanupied.com/berlin/activites-faire-berlin/parc-du-tiergarten-a-berlin.html,Part of the wider analysis of space use and activtiy/duration ,Some,
Winter Fun in the Tents,Print,Tents,"Activities, Ice Skating, Tents, 1820-1833, Winter",,https://drive.google.com/file/d/1QaT7RgSUwCld69nNhXeEpLp0vjCD2N1I/view?usp=sharing,http://www.smb-digital.de/eMuseumPlus?service=ExternalInterface&module=collection&objectId=876766&viewType=detailView,,Part,
The boxers - Keith Harring,Photo,Public Art,"Places, Monument, Art",,https://drive.google.com/file/d/1sEjAZ1WC7Hm2IJUCUFkFXoCuxo8GleRW/view?usp=sharing,https://en.wikipedia.org/wiki/The_Boxers_(sculpture),Modern/non national commemoration pieces throguhgout the park. ,Part,
Unveiling of Monument to Queen Luise,Painting,Luiseninsel,"Places, Monument, Event, 1890-1900, Flags, Crowds, Luiseninsel",,https://drive.google.com/file/d/1UKkh_2oK_PkxkWSSyxIxjzKbKO7un5ry/view?usp=sharing,http://www.smb-digital.de/eMuseumPlus?service=ExternalInterface&module=collection&objectId=962474&viewType=detailView,"The queen died in 1810, why was this statue constucted 70 years later? All figures in crowd are important persons, painted to the degree that they were recognized and written about at the time. ",Part,
Soviet Memorial Posting,Photo,Soviet War Memorial,"Places, Monument, Memorial, Guards ",,https://drive.google.com/file/d/1lcz4Sy2uGGIbkAndyDYwp8mZ3f5359d2/view?usp=sharing,https://www.vanupied.com/berlin/activites-faire-berlin/parc-du-tiergarten-a-berlin.html,History of the soviet memorial as a marker of East and West berlin  documented throguh pictures,Part,
Luiseninsel,Etching,Luiseninsel,"Landscape, Monument, Plantings, Landscape, Etching",,https://drive.google.com/file/d/1EH4K2qLJL-Vp7YnaGZhQbZZZv8SMx_ne/view?usp=sharing,https://de.wikipedia.org/wiki/Luiseninsel,"The Luiseninsel is an decorative horitcultural complex and island that hosted the first monument to Queen Luise, established 1809. The sculptural Monument to Queen Luise is significantly later. ",Part,
Tiergarten - Rufus Wainwright,Song ,Songs About the Tiergarten,"Narrative, Songs, Experience, Walking, Social",,https://drive.google.com/file/d/1WJDe25GCYqLigY7nmFbYe2Asomcuggqz/view?usp=sharing,https://www.youtube.com/watch?v=7mc8bI3it64,,Part,
Tree Series - Charles Gains,Painting,Trees,"Drawing/Painting, Contemporary Art, Second Perspective, Trees, Walking",,https://drive.google.com/file/d/133y5Rp7YfCnxD0yEmLw-POOtmtWCRNCL/view?usp=sharing,https://www.artbasel.com/catalog/artwork/68918/Charles-Gaines-Numbers-and-Trees-Tiergarten-Series-II-Tree-2-Eagle,"American Artist. Second degree perspective, interesting perception of space thrgouht the bi colored grid",Part,
1743 Map of Tiergarten,Map,"Maps, 1700s","Maps, 1700s, Nomenclature, 1740-1750, Tree planting, Master planning",,https://drive.google.com/file/d/1mOAAprfKAWd_rlkn_n8QgEFj12VwgIwx/view?usp=sharing,https://upload.wikimedia.org/wikipedia/commons/8/89/Plan_Tiergarten_Berlin%2C_1743.jpg,Labels the Tiergarten area as Thier Garthen? Maybe an older spelling to look for. Other areas which will eventually become encomassed by the Tiergarrten are also labelled with 18th c. names.,All,
Depression Elevation,Picture,Architecture,"Drawing/Painting, Contemporary Art, Casting, Colorful",,https://drive.google.com/file/d/1J6KXvF2PQ8KMroJSO-5gMT4BfUSm8kzl/view?usp=sharing,https://www.artbasel.com/catalog/artwork/44658/Daniel-Knorr-Depression-Elevation-Berlin-Tiergarten-Constant,Physical polyurethane casting of the site,All,
Christo - Wrapped Reichstag,Drawing,Contemporary Art,"Drawing/Painting, Contemporary Art, Fabric, Wrapping",,https://drive.google.com/file/d/1IQK2imhNTrQVfwTjQ7X766drctoTtNKt/view?usp=sharing,https://www.artbasel.com/catalog/artwork/44113/Horacio-Coppola-Bauhaus-Berlin,Large scale public art work relating to other cities - see cureently the wrapping of the Arc De Triomphe in Paris,Part,
Love parade,Link,Event,"Events , Festival, Music Festival, Electronic Music, Crowds",,https://drive.google.com/file/d/1u1GaJGUVpBCmZ40RtAJ1GFr-gr0g0Xjb/view?usp=sharing,https://www.berlinloveparade.com/,"Electronic dance music festival, Shut down after 2010 becasue a stampede killed 21 people. It is making a comeback in 2022.",Part,
Tiergarten - Tangerine Dream,Song ,Songs About the Tiergarten,"Narrative, Songs, Background music, Instrumental",,https://drive.google.com/file/d/1SIRHa8tSPCFbTaORQFd_sNiZl2jxXPMk/view?usp=sharing,https://open.spotify.com/track/42z91vzHbiApUlH099Wg2k?si=eb75b8bdd48045f6,Instrumental Music,Part,
Tiergarten Map 1765,Map,"Maps, 1700s","Maps, Nomenclature, Plantings, 1760-1770",,https://drive.google.com/file/d/1rLlVbem3YwdJ-dKGe3ZoXG2VMj0jfC-B/view?usp=sharing,https://upload.wikimedia.org/wikipedia/commons/c/c3/Geometrischer_plan_des_Koeniglichen_Thiergartens_vor_Berlin_1765.jpg,"Interesting to see the river directionality indicated. Illustration seems to differentiated between different tree species by planting location, possible record to find?",Some,
